<?xml version="1.0" encoding="UTF-8"?>
<books xmlns="http://www.mingrisoft.com" xmlns:xsi="http://www.w3.org/2001/XMLSchema-instance"
	xsi:schemaLocation="http://www.mingrisoft.com restriction_complexContent_demo.xsd">
	<book>
		<name>《C#從入門到精通(第2版)》</name>
		<publisher>清華大學出版社</publisher>
		<company>明日科技</company>
		<author>王小科</author>
		<ISBN>9787302226628</ISBN>
		<price>69.80</price>
		<url>http://www.mingribook.com/bookinfo.php?id=227</url>

	</book>
</books>
